{
  "$schema": "https://json-schema.org/draft/2020-12/schema",
  "$id": "https://dshdesktop.local/schemas/compatibility.schema.json",
  "title": "DSH Desktop runtime compatibility matrix",
  "type": "object",
  "additionalProperties": false,
  "required": ["schemaVersion", "updatedOn", "defaultChannel", "combinations"],
  "properties": {
    "schemaVersion": { "const": 1 },
    "updatedOn": { "type": "string", "format": "date" },
    "defaultChannel": { "enum": ["stable", "beta", "dev"] },
    "combinations": {
      "type": "array",
      "minItems": 1,
      "items": {
        "type": "object",
        "additionalProperties": false,
        "required": [
          "runtimeId", "desktopVersion", "dshVersion", "nodeVersion", "pnpmVersion",
          "platform", "architecture", "profileSchema", "status", "channels",
          "publishable", "evidence", "notes"
        ],
        "properties": {
          "runtimeId": { "type": "string", "minLength": 1 },
          "desktopVersion": { "$ref": "#/$defs/exactVersion" },
          "dshVersion": { "$ref": "#/$defs/exactVersion" },
          "nodeVersion": { "$ref": "#/$defs/exactVersion" },
          "pnpmVersion": {
            "oneOf": [
              { "$ref": "#/$defs/exactVersion" },
              { "type": "null" }
            ]
          },
          "platform": { "enum": ["win32", "darwin", "linux"] },
          "architecture": { "enum": ["x64", "arm64"] },
          "profileSchema": { "type": "integer", "minimum": 1 },
          "status": { "enum": ["development", "candidate", "verified", "blocked", "retired"] },
          "channels": {
            "type": "array",
            "minItems": 1,
            "uniqueItems": true,
            "items": { "enum": ["stable", "beta", "dev"] }
          },
          "publishable": { "type": "boolean" },
          "evidence": {
            "type": "object",
            "additionalProperties": false,
            "required": ["unitTestCount", "releaseBuild", "webViewSmoke", "fullDshStartup"],
            "properties": {
              "unitTestCount": { "type": "integer", "minimum": 0 },
              "releaseBuild": { "type": "string", "minLength": 1 },
              "webViewSmoke": { "type": "string", "minLength": 1 },
              "fullDshStartup": { "type": "string", "minLength": 1 }
            }
          },
          "notes": {
            "type": "array",
            "items": { "type": "string" }
          }
        }
      }
    }
  },
  "$defs": {
    "exactVersion": {
      "type": "string",
      "pattern": "^[0-9]+\\.[0-9]+\\.[0-9]+(?:-[0-9A-Za-z.-]+)?(?:\\+[0-9A-Za-z.-]+)?$"
    }
  }
}
