{
  "$schema": "./compatibility.schema.json",
  "schemaVersion": 1,
  "updatedOn": "2026-09-19",
  "defaultChannel": "dev",
  "combinations": [
    {
      "runtimeId": "dev-dsh-0.1.5-alpha.1-win-x64-node-24.20.0",
      "desktopVersion": "1.0.0",
      "dshVersion": "0.1.5-alpha.1",
      "nodeVersion": "24.20.0",
      "pnpmVersion": null,
      "platform": "win32",
      "architecture": "x64",
      "profileSchema": 1,
      "status": "development",
      "channels": ["dev"],
      "publishable": false,
      "evidence": {
        "unitTestCount": 319,
        "releaseBuild": "passed",
        "webViewSmoke": "passed",
        "fullDshStartup": "blocked-profile-dependency"
      },
      "notes": [
        "Values describe the runtime currently present in the local ignored DSHDesktop/runtime directory.",
        "The pnpm version is not pinned, so this combination cannot be promoted to beta or stable.",
        "The WebView smoke host passed; a complete packaged DSH startup is not yet claimed."
      ]
    }
  ]
}
